answers,link,questions
"1|| Men of ancient Sparta. ||2|| Rubik’s cube (world record). ||3 ||Swiss Alps (Eiger, Mönch and Jungfrau mountains). ||4|| Tonic sol-fa. ||5 ||Harrogate Town. ||6 ||Pont du Gard. ||7 ||Greenland shark.||8 ||Brigitte Bardot (by Serge Gainsbourg). ||9 ||Played “fingers” on screen: Goldfinger; Bowfinger; Littlefinger (Game Of Thrones). ||10 ||Heirs to European thrones: Spain; Netherlands; Sweden; Belgium. ||11 ||North Sea oil and gas fields. ||12 ||Unfinished classical works. ||13 ||Capitals of US states admitted to the Union in the 20th century: Oklahoma; New Mexico; Arizona; Alaska; Hawaii. ||14 ||Alpine ski race abbreviations: downhill; super-G; giant slalom; slalom; alpine combined. ||15 ||The Fall: wrote novel; sang in band; starred in TV drama.",https://www.theguardian.com/lifeandstyle/2020/oct/10/where-does-an-ogre-stand-near-a-monk-and-a-maiden-the-weekend-quiz,1|| What group was|| ||told “shave your moustache and obey the laws”?||2|| What did Yusheng Du solve in 3.47 seconds? ||3 ||Where does an ogre stand near a monk and a maiden? ||4|| What form of music notation was invented by Sarah Glover? ||5|| Which Football League newcomers are the Sulphurites? ||6|| What famously carried water to Roman Nîmes? ||7 ||Which shark is the longest-living vertebrate? ||8 ||Je T’aime… Moi Non Plus was originally written for whom? ||What links: ||9 ||Gert Fröbe; Steve Martin; Aidan Gillen? ||10 ||Leonor; Catharina-Amalia; Victoria; Elisabeth? ||11 ||Troll; Oseberg; Ekofisk; Brent; Forties? ||12 ||Bach’s Art of Fugue; Mozart’s Requiem; Schubert’s 8th Symphony; Puccini’s Turandot? ||13 ||Oklahoma City; Santa Fe; Phoenix; Juneau; Honolulu? ||14 ||DH; SG; GS; SL; AC (in winter sports)? ||15 ||Albert Camus; Mark E Smith; Gillian Anderson?
"1 ||Marlee Matlin (best actress, Children Of A Lesser God). ||2 ||1650s (1655-57). ||3|| Most haunted house in England (according to psychic researcher Harry Price). ||4 ||Pineal. ||5 ||River Plate. ||6 ||Manchester United and Liverpool. ||7 ||Cú Chulainn. ||8 ||Reindeer/caribou. ||9|| Start and end points of Lewis and Clark’s expedition. ||10 ||Dedicatees of Elgar’s Enigma Variations: Ysobel; Troyte; Nimrod; CAE. ||11 ||David Blaine stunts. ||12 ||Fluke. ||13 ||Smaller wild cats of South and Central America. ||14 ||Double letter i: shiitake; skiing; Pompeii; Hawaii. ||15 ||Literary characters killed by trains: Anna Karenina; The Prime Minister; Dombey and Son.",https://www.theguardian.com/lifeandstyle/2020/oct/17/what-links-a-worm-and-a-whales-tail-the-weekend-quiz,"1|| Who gave her 1987 Oscar acceptance speech in sign language? ||2|| In what decade was England ruled by major-generals? ||3|| Borley Rectory in Essex was once infamous as what? ||4|| Which gland secretes melatonin? ||5 ||Which estuary is formed by the Paraná and Uruguay rivers? ||6 ||Phil Chisnall in 1964 was the last transfer between which football clubs? ||7 ||Sétanta was the birth name of which mythical hero? ||8 ||What is the only female deer to typically grow antlers? ||What links: ||9 ||Camp Dubois, Illinois, and Fort Clatsop, Oregon (1804-06)? ||10 ||Isabel Fitton; Arthur Griffith; August Jaeger; Caroline Elgar? ||11 ||Ascension; Electrified; Above The Below; Vertigo; Buried Alive? ||12 ||Parasitic worm; part of an anchor or whale’s tail; stroke of luck? ||13 ||Kodkod; margay; oncilla; ocelot; jaguarundi? ||14 ||Japanese mushroom; Nordic or Alpine; buried in AD79; US island state? ||15 ||Tolstoy’s Anna Karenina; Trollope’s Ferdinand Lopez; Dickens’ James Carker?"
1 ||Banquo (in Macbeth).||2 ||Cuba.||3 ||Ruth Bader Ginsburg.||4 ||Cuckoos (and other brood parasites).||5|| Novelist Elizabeth Taylor (1912-75).||6|| Las Vegas Raiders (formerly Oakland Raiders).||7 ||Graphics interchange format.||8 ||Alexander Borodin.||9 ||North Sea (and Thames estuary) sandbanks.||10 ||Brothers of Napoleon Bonaparte (and their kingdoms).||11 ||Recent chief cashiers of the Bank of England.||12 ||John/Jon Snows: 19th-century doctor; 1960s/70s cricketer; presented Channel 4 news since 1989; in Game Of Thrones.||13 ||Iron curtain (according to Churchill’s 1946 speech).||14 ||Winning distances in horse races.||15 ||Penguins named after them: Adélie; Magellanic; Humboldt.,https://www.theguardian.com/lifeandstyle/2020/oct/24/which-russian-composer-was-a-chemistry-professor-the-weekend-quiz,"1 ||Who was the original ghost at the feast?||2 ||Where is the Henry Reeve International Medical Brigade from?||3 ||Who was nicknamed the Notorious RBG?||4 ||Which wild birds never meet their parents?||5 ||The Other Elizabeth Taylor was a biography of whom?||6 ||Which NFL team plays in Paradise, Nevada?||7 ||What does the acronym GIF stand for?||8 ||Which Russian composer was a chemistry professor?||What links:||9|| Nore; Cleaver; Dogger; Hammond’s Knoll?||10|| Joseph of Naples & Spain; Louis of Holland; Jérôme of Westphalia?||11 ||Sarah John; Victoria Cleland; Chris Salmon; Andrew Bailey?||12 ||Cholera pioneer; fast bowler; C4 news; northern bastard?||13 ||Stettin and Trieste?||14 ||Nose; short head; head; neck?||15 ||Adèle Dumont d’Urville; Ferdinand Magellan; Alexander von Humboldt?"
"1|| Francis Ford Coppola (Apocalypse Now). ||2|| Sappho. ||3|| Synchronised swimming, officially renamed artistic swimming in 2017. ||4|| Brazil (Tropic of Capricorn). ||5|| Kaiser Wilhelm II and Tsar Nicholas II. ||6|| Solar wind. ||7|| Island of Patmos. ||8|| This American Life. ||9|| Cathedral towns in England. ||10|| Number of members in lower house of legislature: Bundestag; House of Commons; Lok Sabha; House of Representatives. ||11|| Hairstyle inventors: Marcel wave; the beehive; the Rachel. ||12|| Animals named after places in Kent: Sandwich tern; Dartford warbler; Dover sole. ||13|| First women in space: USSR; US; UK; China. ||14|| UK recording studios (past and present). ||15|| Cluedo murder weapons: Candlestick (Park); Revolver; Rope; lead (piping).",https://www.theguardian.com/lifeandstyle/2020/sep/19/what-was-the-first-pulitzer-winning-podcast-the-weekend-quiz,"1|| Who said “My film is not about Vietnam, it is Vietnam”? ||2|| Plato called which poet the 10th Muse? ||3|| What was synchronised, but is now artistic? ||4|| What is the only country crossed by the equator and a “tropic”? ||5|| Who conducted the Willy-Nicky correspondence? ||6|| Which wind was predicted by Eugene Parker? ||7|| Where did the visions in the Book of Revelation take place? ||8|| What was the first podcast to win a Pulitzer prize? ||What links: ||9|| Blackburn; Bury St Edmunds; Guildford; Rochester; Southwell? ||10|| Germany (709); UK (650); India (545); US (435)? ||11|| Marcel Grateau; Margaret Vinci Heldt; Chris McMillan? ||12|| Garden of England and a tern, warbler and sole?||13 ||Valentina Tereshkova; Sally Ride; Helen Sharman; Liu Yang? ||14|| The Manor; Morgan; Ridge Farm; Rockfield; Strawberry? ||15|| Old San Francisco stadium; 1966 Beatles album; 1948 Hitchcock film; Pb?"
"1|| Mary Queen of Scots.||2|| West Germany’s win in the 1954 World Cup.||3|| Wombat.||4|| Etna.||5|| Captain Swing.||6|| Esperanto.||7|| Nails.||8|| Death Valley, California.||9|| Pre-decimal currency: (Ezra) Pound; (David) Shilling; (Mike) Pence.||10|| Crosby, Stills, Nash & Young (former groups).||11|| Scandals given “-gate” suffix: Billy Carter; arms to Iran; Harlequins rugby; New England Patriots; VW emission tests.||12|| Moths.||13|| M4 motorway.||14|| Lines in palmistry.||15|| Fictional old Etonians.",https://www.theguardian.com/lifeandstyle/2020/sep/26/what-was-footballs-miracle-of-bern-the-weekend-quiz,"1|| Whose body was moved from Peterborough to Westminster Abbey in 1612?||2|| What was football’s Miracle of Bern?||3|| Which marsupial is the world’s largest burrowing animal?||4|| Which mountain is said to be named from the Greek for “I burn”?||5|| Who was the purported leader of rural riots in 1830?||6|| A denaskulo is a rare native speaker of what language?||7|| OPI founder Suzi Weiss-Fischmann is known as the first lady of what?||8|| Where was a temperature of 54.4°C recorded in August?||What links:||9|| The Cantos poet; Royal Ascot milliner; US VP?||10|| The Byrds; Buffalo Springfield; the Hollies?||11|| Billy; Iran; Blood; Deflate; Diesel?||12|| Chimney sweeper; angle shades; silver Y; vapourer?||13|| Chiswick and Pont Abraham, Carmarthenshire?||14|| Heart; Head; Life; Sun; Mercury; Fate?||15|| Mark Darcy; Bertie Wooster; James Bond; Captain Hook?"
"1 ||Flodden (1513). ||2|| Mary Wollstonecraft. ||3|| Bread and beer/wine (yeast). ||4|| In space (Mir and ISS). ||5|| Measure for Measure. ||6|| Bernard Weatherill. ||7|| Nando’s. ||8 ||Faslane. ||9 ||Families in the original Happy Families game. ||10|| Gave their names to fruits: Clementine; Cavendish banana; Granny Smith apple; Bramley apple. ||11 ||Great Wall of China (east to west, Ming dynasty wall). ||12|| Types of squid. ||13 ||Fictional worlds created by the young Brontë siblings. ||14 ||VW models: Touareg (Tuareg people); Atlas; Golf; Polo. ||15 ||Birthplaces of wartime Big Three: Churchill; Roosevelt; Stalin.",https://www.theguardian.com/lifeandstyle/2020/nov/07/which-battlefield-has-a-visitor-centre-in-a-phone-box-the-weekend-quiz,"1|| Which Anglo-Scottish battlefield has a visitor centre in a phone box? ||2|| Mary is which Mary’s only completed novel? ||3 ||What is ||Saccharomyces cerevisiae|| used to make? ||4|| Where did Gennady Padalka spend a record 879 days? ||5 ||Which Shakespeare play is set in Austria? ||6 ||Who was the last Commons speaker to wear a wig? ||7 ||Which restaurant chain began in 1987 in Johannesburg? ||8|| HM Naval Base Clyde is better known as what? ||What links: ||9|| Block; Bones; Bun; Bung; Chip; Dip (and five more)? ||10|| Clément Rodier; William Cavendish; Maria Ann Smith; Matthew Bramley? ||11 ||Mount Hu, Liaoning and Jiayu Pass, Gansu? ||12 ||Humboldt; Japanese flying; cock-eyed; giant; colossal? ||13|| Glass Town; Angria; Gondal? ||14|| Saharan nomads; map book; club and ball sport; horseback sport? ||15|| Blenheim Palace; Hyde Park, New York; Gori, Russian Empire?"
What links: ||9|| Charles III; William V; George VII; Charlotte I? ||10|| Line; bar; pie; scatter; spider? ||11 ||Spithead and Nore in 1797; Invergordon in 1931? ||12|| New Orleans tram; collection of animal figurines; Brick’s wife Maggie? ||13|| Lima; Baghdad; Tehran; Bamako; Muscat; Havana? ||14 ||The Beach Boys; Kings of Leon; Bee Gees; Haim? ||15|| Nancy Astor; Margaret Wintringham; Margaret Bondfield and two others?,https://www.theguardian.com/lifeandstyle/2020/dec/05/what-links-line-bar-pie-scatter-and-spider-the-weekend-quiz,1|| Who was the first named Native American on a US stamp? ||2 ||Which archipelago is at the mouth of Galway Bay? ||3|| The Pythia was the priestess at which ancient site?||4 ||Who died hours after the 33rd performance of Carmen? ||5|| Which dog has Pembroke Welsh and Cardigan Welsh breeds? ||6|| Where did the Joseon dynasty rule for more than 500 years? ||7|| Which portrait was stolen in 1961 as a protest against the TV licence fee? ||8 ||When was English cricket’s summer of four captains? 
"1|| Eva Marie Saint.||2|| Turnstone.||3|| We Can Do It! (Rosie the Riveter).||4|| China.||5|| Gene Simmons (from Kiss).||6|| Queen’s Park FC (1867).||7|| Lonrho (Tiny Rowland).||8|| Mercury and bromine.||9|| Mule: offspring of male donkey and female horse; mule shoe; invented spinning mule; partnered Muffin the Mule on TV.||10|| Musical “kings”: Waltz King; March King; King of Swing; the King (of Rock’n’roll).||11|| Number of known moons of planets, in order from Sun: Mercury; Venus; Earth; Mars; Jupiter; Saturn.||12|| Google search tools.||13|| London palaces destroyed by fire.||14|| South African diamond mines.||15|| Comedy double acts (real names): Morecambe & Wise; Little & Large; Cannon & Ball.",https://www.theguardian.com/lifeandstyle/2020/dec/12/what-did-ted-heath-call-the-unacceptable-face-of-capitalism-the-weekend-quiz,"1|| Who gave birth two days after winning an Oscar for On The Waterfront?||2|| Which bird is named for its pebble-flipping behaviour?||3|| Naomi Parker inspired which US wartime poster?||4|| In what country is East Turkestan?||5|| Which rock star’s autobiography was called Kiss And Make-Up?||6|| What is Scotland’s oldest football club?||7|| What did Ted Heath call the “unacceptable face of capitalism”?||8|| Which two elements are liquids at standard temperature and pressure?||What links:||9|| Jack and mare; backless shoe; Samuel Crompton; Annette Mills?||10|| Johann Strauss II; John Philip Sousa; Benny Goodman; Elvis Presley?||11|| 1||st|| (0); 2||nd|| (0); 3||rd|| (1); 4||th|| (2); 5||th|| (79); 6||th|| (82)?||12|| Books; Images; News; Patents; Shopping?||13|| Savoy, 1381; Whitehall, 1698; Westminster, 1834?||14|| Venetia; Finsch; Koffiefontein; Cullinan; Kimberley?||15|| Bartholomew & Wiseman; Mead & McGinnis; Derbyshire & Harper?"
1 ||Domesday Book/survey.||2 ||Neanderthal.||3 ||The Interview.||4 ||Good King Wenceslas.||5 ||Cannabis (Tetrahydrocannabinol).||6 ||On a bird (it’s the wishbone/furcula).||7 ||Spider.||8|| David Bowie.||9 ||Meanings of artists’ names: El Greco; Fra Angelico; Tintoretto; Botticelli.||10 ||People who faked their own deaths: medieval nun; Russian journalist; “canoe” man; Labour politician.||11|| Robin: bird’s scientific name; Batman’s sidekick.||12|| Parts of an arrow.||13 ||Played TV witches: A Discovery Of Witches; Bewitched; Sabrina The Teenage Witch; Buffy The Vampire Slayer.||14 ||Defunct social networks.||15|| Locations of addressees of St Paul’s epistles.,https://www.theguardian.com/lifeandstyle/2020/dec/19/which-singer-introduced-the-snowman-animation-on-tv-the-weekend-quiz,"1|| What was planned at the Christmas court at Gloucester in 1085?||2 ||Homo stupidus was a proposed name for which hominid?||3 ||North Korea called which comedy film a “blatant act of terrorism”?||4 ||Which carol is about almsgiving on 26|| ||December?||5 ||THC is the main psychoactive constituent of what?||6 ||Where would you find a merrythought?||7 ||Rediscovered in Surrey this year, what creature is the great fox?||8 ||Which singer introduced The Snowman animation on TV?||What links:||9 ||The Greek; angelic friar; little dyer; little barrel?||10 ||Joan of Leeds; Arkady Babchenko; John Darwin; John Stonehouse?||11 ||Erithacus rubecula|| and Dick Grayson?||12 ||Head; shaft; fletching; nock?||13 ||Teresa Palmer; Elizabeth Montgomery; Melissa Joan Hart; Alyson Hannigan?||14 ||Wave; Buzz; Meerkat; Yik Yak; Vine?||15 ||Rome; Corinth; Ephesus; Philippi; Thessalonica?"
"8|| Whose bones were sold for a record $31.8m in October?||9|| Which temporary structure moved from Welford Park in Berkshire to Down Hall in Essex?||10|| Which number 10 challenged Number 10 on free school meals?||11|| Eric Yuan founded which communications technology company in 2011?||12|| Spotted in the Peak District this summer, what is a lammergeier?||13|| How did Shipley and Tatton personally and politically unite in September?||14|| Who sang the theme song for the still unreleased Bond film No Time To Die?||15|| Who said he’d voted in the US election for “someone I truly trust…me”?||16|| Last month, Rutland ceased to be England’s only county without what?||What links:||17|| Mary Wollstonecraft, controversially; Oscar Wilde; Benjamin Britten?||18|| Jacinda Ardern, New Zealand PM, in May; Katrín Jakobsdóttir, Iceland PM, in October?||19|| Combating world hunger; hepatitis C virus; black hole formation; genetic scissors?",https://www.theguardian.com/lifeandstyle/2020/dec/26/what-links-bob-dylan-with-queen-and-acdc-weekends-bumper-boxing-day-quiz,"1|| Which 94-year-old took under five hours to reach a million followers on Instagram?||2|| Which Welsh town was overrun by Kashmiri goats in March?||3|| Who announced a “Spring 2020 transition”?||4 ||Which fortification was built in the 12||th|| century by Bernard I de Balliol on the banks of the Tees?||5|| How is Joseph Maldonado-Passage described in the title of a Netflix series?||6|| Which item is inscribed with “Peace, prosperity and friendship with all nations”?||7|| Which bowlers took their 500||th|| and 600||th|| Test wickets respectively?"
"1|| Elizabeth I (1588).||2|| Gestalt.||3|| Migrant Mother.||4|| Contactless payment limit.||5|| Belgium, Denmark, Luxembourg, Netherlands, Spain and Sweden.||6|| Sainte-Chapelle.||7|| Coronal mass ejection (from the sun).||8|| John Smith.||9|| Novelists who worked as advertising copywriters.||10|| Teddy bears: John Betjeman’s; Grayson Perry’s; Children in Need mascot.||11|| Places with North and South prefixes.||12|| Draught horse breeds.||13|| Student newspapers: UEA; Durham; Cambridge; Oxford.||14|| Musicals and film musicals missing exclamation marks.||15|| Won four consecutive Olympic golds in the same event: discus; long jump; 200m medley swimming; women’s 63kg wrestling.",https://www.theguardian.com/lifeandstyle/2020/nov/28/what-links-oliver-and-moulin-rouge-the-weekend-quiz,"1|| Who rallied the troops at Tilbury?||2|| What school of psychology is named after the German for “form”?||3|| Florence Thompson was the subject of which Dorothea Lange photograph?||4|| What rose from £30 to £45 in April?||5 ||Which six EU members are monarchies?||6|| What was built in Paris to house the Crown of Thorns?||7|| Part of the space weather forecast, what is a CME?||8|| Which Labour leader climbed 108 Munros||What links:||9|| Dorothy L Sayers; Fay Weldon; Don DeLillo; Salman Rushdie?||10|| Archibald Ormsby-Gore; Alan Measles; Pudsey?||11|| Shields; America; Carolina; Korea?||12|| Clydesdale; Suffolk; Shire; Percheron?||13|| Concrete; Palatinate; Varsity; Cherwell?||14|| Oklahoma; Hello, Dolly; Oliver; Twang; Moulin Rouge?||15|| Al Oerter; Carl Lewis; Michael Phelps; Kaori Icho?"
1|| John Lennon.||2|| Crane flies (daddy long legs).||3|| Peak District (Dark Peak and White Peak).||4|| Meeple (in 2000).||5|| Opposition parties in the House of Lords.||6|| The Railway Children (E Nesbit book).||7|| Placeholder text (in publishing and design).||8|| MCC (Marylebone Cricket Club) members.||9|| Siberian rivers (flowing into the Arctic Ocean).||10|| TV series created by Phil Redmond.||11|| Homophones: miner; minor; myna.||12|| Discovered basic parts of the atom: electron; proton; neutron.||13|| Depicted on the ceiling of the Sistine Chapel.||14|| Sisters of Sherlock Holmes (non-canonical).||15|| English football champions (from places without current city status).,https://www.theguardian.com/lifeandstyle/2020/nov/14/what-links-brookside-and-hollyoaks-the-weekend-quiz,"1|| Which musician left the UK on 31 August 1971 and never returned?||2|| Leatherjackets are the larvae of which insect?||3|| Which national park is divided into Dark and White areas?||4|| Alison Hansel coined what term for a board game figure?||5|| What are funded by Cranborne money?||6|| Who are Bobbie, Peter and Phyllis?||7|| The Lorem Ipsum text is used for what?||8|| Who wears egg-and-bacon ties?||What links:||9|| Lena; Ob; Yenisei?||10|| Grange Hill; Brookside; Hollyoaks?||11|| Mineral extractor; under-18; talking starling?||12|| Thomson, 1897; Rutherford, 1917-20; Chadwick, 1932?||13|| Nine scenes from Genesis; seven prophets; five sibyls; Christ’s ancestors?||14|| Eurus and Enola?||15|| WBA; Huddersfield; Burnley; Ipswich; Blackburn?"
"1|| The Great Gatsby.||2|| Umami.||3|| Bedford College, London (1849).||4|| Peru (Nazca lines).||5|| Washington DC (Capital Beltway)||6|| Crimean war.||7|| Olm (proteus).||8|| Ted Kaczynski (AKA The Unabomber).||9|| Married Rupert Murdoch: Patricia; Anna; Wendi; Jerry.||10|| German royal dynasties.||11|| Shoes: The Red Shoes; Ballet Shoes (and Tennis Shoes); Crocodile Shoes.||12|| Found by dogs (Robot and Pickles).||13|| Parts of the outer ear.||14|| Baseball fielding positions: pitcher, catcher; 1st-2nd-3rd base; short stop; left field; centre field; right field.||15|| Modern black and white films.",https://www.theguardian.com/lifeandstyle/2020/nov/21/what-links-a-helix-and-a-lobule-the-weekend-quiz,"1|| The phrase “old sport” appears 45 times in which novel?||2|| Which basic taste has a Japanese name?||3|| What was the UK’s first higher education institution for women?||4|| Where was a 37m cat geoglyph revealed recently?||5|| Which city is encircled by Interstate 495?||6|| Roger Fenton photographed which conflict?||7|| Which blind salamander is found only in the Balkans?||8|| Who, notoriously, wrote the essay Industrial Society And Its Future?||What links:||9|| Booker; Torv; Deng; Hall?||10|| Ottonian; Salian; Hohenstaufen; Welf?||11|| Moira Shearer film; Noel Streatfeild books; Jimmy Nail drama?||12|| Lascaux caves in 1940; Jules Rimet Trophy in 1966?||13|| Tragus; helix; lobule?||14|| P; C; 1B; 2B; 3B; SS; LF; CF; RF?||15|| Roma; Frances Ha; Control; La Haine; Ed Wood?"
"1 ||Played grand slam events as both a man and a woman.||2|| American civil war.||3 ||Pablo Escobar.||4|| Neptune.||5|| Passport To Pimlico.||6 ||Beryl Bainbridge.||7|| Lilliput (in Gulliver’s Travels).||8|| Habsburgs.||9|| US presidential dogs: Trump; Obama; W Bush.||10|| Crusader states established after First Crusade (along with Kingdom of Jerusalem).||11|| Painted by Leonardo da Vinci: Lady With An Ermine; Mona Lisa; portrait.||12|| Places mentioned in song (Get Your Kicks On) Route 66.||13|| Leaders of main Irish political parties: Fianna Fáil; Fine Gael; Sinn Féin.||14|| Collapsed banks: 1878; 1991; 1995; 2008.||15|| E adding a letter: e (mathematical constant); eg; ego; EGOT (Emmy, Grammy, Oscar, Tony).",https://www.theguardian.com/lifeandstyle/2020/aug/29/which-planets-moons-are-named-after-water-deities-the-weekend-quiz,"1|| Renée Richards has uniquely done what in tennis? ||2|| What ended at Appomattox Court House?||3 ||Whose escaped pet hippos are causing havoc in Colombia?||4|| Which planet’s moons are named after water deities?||5|| “Blimey, I’m a foreigner!” is a line in what 1940s film?||6|| Who was Booker prize-nominated five times without a win?||7|| What is Blefuscu’s neighbouring island?||8|| Which family ruled Austria for 600 years?||What links:||9|| 45 (none); 44 (Bo and Sunny); 43 (Barney and Miss Beazley)?||10|| Counties of Edessa and Tripoli; Principality of Antioch?||11|| Cecilia Gallerani; Lisa Gherardini; Ginevra de’ Benci?||12|| Joplin; Amarillo; Gallup; Flagstaff; Kingman?||13|| Micheál Martin; Leo Varadkar; Mary Lou McDonald?||14|| City of Glasgow; BCCI; Barings; Lehman Brothers?||15|| Approx 2.71828; for example; the self; show business grand slam?"
1|| Being dissected (anatomy lesson of Dr Nicolaes Tulp).||2|| Agatha Christie.||3|| Tyrannosaurus rex skeleton (found by Susan Hendrickson).||4|| Circumcision (Jewish).||5|| Swift (apus apus).||6|| Stephen Sondheim.||7|| Starfleet cadets in Star Trek.||8|| Australia (Western Australia).||9|| Lost or destroyed works by poets.||10|| Parts of the hip bone.||11|| Films set at sea in the second world war.||12|| Original surnames of female PMs: Margaret Thatcher and Theresa May.||13|| Diacritic marks used in French.||14|| Setter dog breeds (as recognised by Kennel Club).||15|| Persian/Iranian empires and ruling dynasties.,https://www.theguardian.com/lifeandstyle/2020/sep/05/what-is-bisected-by-the-rabbit-proof-fence-the-weekend-quiz,"1|| What is the criminal Aris Kindt doing in a Rembrandt painting?||2|| Who is the bestselling novelist of all time?||3|| What is Sue, dug up in South Dakota in 1990?||4|| Which ritual is performed by a mohel?||5|| What bird’s scientific name means “footless footless”?||6|| Which composer was a neighbour and protege of Oscar Hammerstein?||7|| Who would undertake the Kobayashi Maru test?||8|| What is bisected by the rabbit-proof fence?||What links:||9|| Byron’s memoirs; Sylvia Plath’s novel Double Exposure; Philip Larkin’s diaries?||10|| Ilium; ischium; pubis?||11|| Greyhound; In Which We Serve; The Cruel Sea; Das Boot?||12|| Roberts and Brasier?||13|| Acute; grave; circumflex; cedilla; diaeresis?||14|| English; Irish; Irish Red & White; Gordon?||15|| Achaemenid; Sasanian; Safavid; Qajar; Pahlavi?"
"1|| Olympic Games (chariot race, as an owner/trainer).||2|| Wagner (according to Rossini).||3|| Nobel prize in economics.||4|| Dodo.||5|| South America.||6|| Encounter (established 1953).||7|| Boules.||8|| Sinking of the Titanic.||9|| First and last major battles of the hundred years war.||10|| Works whose copyright/royalties donated to charity: Great Ormond Street hospital; Scouts; Red Cross; NAACP.||11|| Asian deserts (Iran (x 2); India/Pakistan; Turkmenistan; Israel).||12|| Novels by prime ministers: Disraeli; Churchill; Johnson.||13|| String quartets.||14|| Snooker nicknames: David Gilbert; Alan McManus; John Higgins; Mark Selby.||15|| Stars on national flag (from 1 to 6).",https://www.theguardian.com/lifeandstyle/2020/sep/12/which-british-literary-magazine-funded-by-cia-the-weekend-quiz,"1|| In 396 BC, Cynisca became the first woman to win where?||2|| Which composer had “lovely moments but awful quarters of an hour”?||3 ||What prize was founded in 1968 by Sweden’s central bank?||4|| Which bird was the closest relative of the Rodrigues solitaire?||5|| Mercosur is which continent’s trading bloc?||6|| Which British literary magazine was funded by the CIA?||7|| Jeu provençal is a form of which game?||8|| Steiff made black mourning teddies after what event?||What links:||9|| Sluys (1340) and Castillon (1453)?||10|| Peter Pan; God Bless America; Take Five; Dorothy Parker’s works?||11|| Lut; Kavir; Thar; Karakum; Negev?||12|| Sybil; Savrola; Seventy-Two Virgins?||13|| Aeolian; Allegri; Amadeus; Balanescu; Brodsky?||14|| Angry Farmer; Angles; Wizard of Wishaw; Jester from Leicester?||15|| Turkey; Panama; Burundi; New Zealand; China; Australia (ascending order)?"
