answers,link,questions
1|| Dulce et decorum est pro patria mori. ||2|| Yorkshire. ||3|| Margaret Drabble. ||4|| Occitan. ||5|| Kaiser Wilhelm II. ||6|| Hot dog! ||7|| Hormones. ||8|| Kiss. ||9|| UK party symbols: Conservative; Labour; Lib Dem; Green; Plaid Cymru; SNP; Ukip. ||10|| Number of Test-playing cricket sides. ||11|| Crowns in the crown jewels. ||12|| Types of roof. ||13|| Mentioned in Beatles songs: Mr Kite; I Am The Walrus; Revolution; Taxman; I’m So Tired. ||14|| Female-led crime films. ||15|| Last “Roman” Emperors: last Western Roman Emperor; last Byzantine Emperor; last Holy Roman Emperor.,https://www.theguardian.com/lifeandstyle/2019/jan/05/quiz-dog-feeds-hand-that-bites-it-glands-gable-thomas-eaton,"1|| What Horatian maxim was rejected by Wilfred Owen?||2|| Which county was divided into three ridings?||3|| Which literary dame understudied for Vanessa Redgrave at the RSC?||4|| In Toulouse, street signs are in French and what other language?||5|| Which former head of state died in the Netherlands in 1941?||6|| What dog is said to feed the hand that bites it?||7|| What are secreted by the endocrine glands?||8|| Which rock group “unmasked” on MTV in 1983?||What links:||9|| Tree; rose; bird; globe; poppy; thistle; pound?||10|| 1877 (2); 1889 (3); 1928 (4); 1952 (7); 2000 (10); 2018 (12)?||11|| St Edward’s; Imperial State; Queen Mary’s; Queen Mother’s?||12|| Butterfly; flat; gable; hip; mansard; skillion?||13|| Pablo Fanque; Edgar Allan Poe; Mao; Heath and Wilson; Walter Raleigh?||14|| Set It Off; Bound; The Bling Ring; Ocean’s 8; Widows?||15|| Romulus Augustus; Constantine XI Palaeologos; Francis II?"
1|| Ich bin ein Berliner. ||2|| Japan’s Nikkei. ||3|| Nuthatch. ||4|| Brian May. ||5|| Teddy bears. ||6|| Sylvia Pankhurst. ||7|| Where Eagles Dare. ||8|| Ba’ath party. ||9|| Dictionaries’ words of the year for 2018. ||10|| Penelope’s suitors in The Odyssey. ||11|| Meanings of names of cloud types: cumulus; stratus; cirrus; cumulonimbus. ||12|| National parks in Florida. ||13|| Early names for sports: lawn tennis; table tennis; badminton; volleyball; softball. ||14 ||Played Spider-Man on screen. ||15|| Chemical elements by number of letters: phosphorus; aluminium; hydrogen; calcium; carbon; boron; gold; tin.,https://www.theguardian.com/lifeandstyle/2019/jan/19/quiz-gossima-battledore-kitten-ball-andrew-garfield-thomas-eaton,"1|| “As a free man, I take pride in the words...” – what came next?||2|| Which stock market index has never passed its 1989 peak?||3|| Which British bird can climb down trees head-first?||4|| Whose Red Special guitar was partly made from a fireplace?||5|| What would an arctophile collect?||6|| Which suffragette received a state funeral in Ethiopia?||7|| The book Broadsword Calling Danny Boy is about what film?||8|| What political party was founded in Syria in 1943?||What links:||9|| Toxic (Oxford); single-use (Collins); justice (Merriam-Webster)?||10|| 52 from Dulichium; 24 from Same; 20 from Zacynthus; 12 from Ithaca?||11|| Heap; layered; lock of hair; heaped rainstorm?||12|| Dry Tortugas; Big Cypress; Biscayne; Gulf Islands; Everglades?||13|| Sphairistike; gossima; battledore; mintonette; kitten ball?||14|| Nicholas Hammond; Tobey Maguire; Andrew Garfield; Tom Holland?||15|| P (10); Al (9); H (8); Ca (7); C (6); B (5); Au (4); Sn (3)?"
1|| Jane Eyre.||2|| Leg (thigh). ||3|| River dolphin. ||4|| George Weah (Liberian president). ||5|| British Sign Language. ||6|| Ray Galton and Alan Simpson. ||7|| Rio Tinto. ||8|| Poland. ||9|| Defenestrated: in Bible; first defenestration of Prague; second defenestration of Prague. ||10|| First five Winter Olympic hosts. ||11|| Traditional perfume families. ||12|| Paintings by David Bomberg. ||13|| Main islands of St Kilda. ||14|| Gorilla subspecies. ||15|| Screen time in Oscar wins: Network; Shakespeare In Love; The Bad And The Beautiful; Les Misérables.,https://www.theguardian.com/lifeandstyle/2019/jan/26/quiz-african-head-of-state-ac-milan-player-muscle-mud-bath-thomas-eaton,"1|| Who described herself as “poor, obscure, plain and little”? ||2|| Where is the sartorius muscle, the longest in the body? ||3|| What animal is an Amazonian boto? ||4|| Which African head of state used to play for AC Milan? ||5|| What form of communication is BSL? ||6|| Which comedy scriptwriters met in a TB sanatorium near Godalming? ||7|| Which mining conglomerate is named after an Andalusian river? ||8|| Dabrowski’s Mazurka is what country’s national anthem? ||What links: ||9|| Jezebel, c 843BC; Prague councillors, 1419; Bohemian governors, 1618? ||10|| Chamonix (I); St Moritz (II & V); Lake Placid (III); Garmisch-Partenkirchen (IV)? ||11|| Woody; Leather; Chypre; Fougère; Amber; Citrus; Floral? ||12|| The Mud Bath; Vision Of Ezekiel; In The Hold; Ju-Jitsu; Bomb Store? ||13|| Hirta; Dun; Soay; Boreray? ||14|| Western Lowland; Cross River; Eastern Lowland; Mountain? ||15|| Beatrice Straight (five mins); Judi Dench (eight mins); Gloria Grahame (nine mins); Anne Hathaway (15 mins)?"
"1|| Guinness Book of Records. ||2|| Britain’s atomic bomb. ||3|| Cleopatra (VII). ||4|| China and North Korea. ||5|| Royal Albert Hall. ||6|| Captain Corelli’s Mandolin. ||7|| Haiti. ||8|| Racehorses. ||9|| Squares in Rome and the Vatican City. ||10|| Negative prefixes in English. ||11|| Inaugural winners of UK arts prizes: Booker; Turner; Mercury. ||12|| Chemical symbols consisting only of vowels: O; I; Au; Eu; U. ||13|| US intercollegiate sports conferences. ||14|| Influential playlists on Spotify. ||15|| Played Mary, Queen of Scots in films.",https://www.theguardian.com/lifeandstyle/2019/jan/12/quiz-primal-scream-ph-newby-malcolm-morley-mushrooms-rap-caviar-thomas-eaton,"1|| What resulted from an argument over the fastest game bird in Europe?||2|| Ernest Bevin wanted the “bloody Union Jack on top” of what?||3|| Charmion was the servant and confidante of which monarch?||4|| Which countries are separated by the Yalu river?||5|| What venue has 85 acoustic diffusers, known as “mushrooms”?||6|| Antonia is the title instrument in what novel?||7|| What is the second oldest independent nation in the Americas?||8|| What has Tattersalls sold since 1766?||What links:||9 ||Navona; Campidoglio; di Spagna; del Popolo; St Peter’s?||10|| A; dis; il; im; in; ir; non; un?||11|| PH Newby, 1969; Malcolm Morley, 1984; Primal Scream, 1992?||12|| Oxygen; iodine; gold; europium; uranium?||13|| Pac-12; Sun Belt; Big 12; SEC; The American; MW?||14|| Beast Mode; RapCaviar; Today’s Top Hits; New Music Friday?||15|| Katharine Hepburn; Vanessa Redgrave; Samantha Morton; Saoirse Ronan?"
"1|| Swaziland. ||2|| Spread betting. ||3|| Mary Rose. ||4|| Cobra (Copenhagen, Brussels and Amsterdam). ||5|| Rugby league. ||6|| Argo. ||7|| Now That’s What I Call Music. ||8|| Jaguar. ||9|| Chinese tech companies. ||10|| Cabinet members who became PM: Callaghan; Major and Brown; May. ||11|| Based on works of ETA Hoffmann: The Tales Of Hoffmann and Cardillac; Coppélia and The Nutcracker. ||12|| Varnas/divisions of the Hindu caste system. ||13|| Vodka-based cocktails: Cosmopolitan (editor); White Russian; screwdriver; Bloody Mary (Mary I’s reign). ||14|| Lakes around New Orleans. ||15|| Female lead in A Star Is Born: 1937; 1954; 1976; 2018.",https://www.theguardian.com/lifeandstyle/2018/sep/29/quiz-janet-gaynor-judy-garland-barbra-streisand-lady-gaga-thomas-eaton,"1|| Which country was renamed the Kingdom of eSwatini this year?||2|| What form of betting was invented by ex-teacher Charles McNeil?||3|| Which ship sank in 1545 during the Battle of the Solent?||4|| What art movement was named from the Danish, Belgian and Dutch capitals?||5|| Magic Weekend is an annual event in which sport?||6|| Which film dramatised 1980’s “Canadian caper”?||7|| What pop compilation series reached its 100th edition in July?||8|| What is the largest cat in the Americas?||What links:||9|| Alibaba; Tencent; Baidu; Huawei?||10|| Foreign secretary, 1976; chancellor, 1990 and 2007; home secretary, 2016?||11|| Operas by Offenbach and Hindemith; ballets by Delibes and Tchaikovsky?||12|| Brahmin; Kshatriya; Vaishya; Shudra?||13|| Helen Gurley Brown; Minsk native; flathead or Phillips; 1553-58?||14|| Salvador; Borgne; Maurepas; Pontchartrain?||15|| Janet Gaynor; Judy Garland; Barbra Streisand; Lady Gaga?"
1|| Corsica. ||2|| Pinkerton’s National Detective Agency. ||3|| Genealogies of European royal families. ||4|| Mickie Most. ||5|| Coffee. ||6|| Julian of Norwich. ||7|| Economic Sciences (Economics). ||8|| Sherwood Forest. ||9|| Chicken breeds named after English places. ||10|| Played George VI: The King’s Speech; The Crown; Churchill; Darkest Hour. ||11|| Spectral classification of stars. ||12|| Targeted by suffragettes. ||13|| 1985 famine relief charity records: US; Canada; Latin America; French artists. ||14|| The Little… literary works: Donna Tartt; Sarah Waters; Hans Christian Andersen; Antoine de Saint-Exupéry. ||15|| Birthplaces of British Tour de France winners: Bradley Wiggins; Chris Froome; Geraint Thomas.,https://www.theguardian.com/lifeandstyle/2018/oct/06/quiz-major-oak-rak-records-rokeby-venus-thomas-eaton,"1 ||In 1794, which island voted to leave France and join with Great Britain?||2|| “We never sleep” was the motto of which US agency?||3|| What are listed in the Almanach de Gotha?||4|| Which producer founded Rak Records?||5|| What drink is monsooned Malabar?||6|| Which female mystic wrote Revelations Of Divine Love?||7|| Which Nobel prize was first awarded in 1969?||8|| The Major Oak is an ancient tree in which woodland?||What links:||9|| Dorking; Ixworth; Orpington; Sussex; Derbyshire redcap?||10|| Colin Firth; Jared Harris; James Purefoy; Ben Mendelsohn?||11|| O, blue; B, blue-white; A, white; F, yellow-white; G, yellow; K, orange; M, red?||12|| Rokeby Venus; Kew tea pavilion; Epsom Derby; Lloyd George’s house?||13|| We Are The World; Tears Are Not Enough; Cantaré, Cantarás; Ethiopie?||14|| Friend; Stranger; Mermaid; Prince?||15|| Ghent, 1980; Nairobi, 1985; Cardiff, 1986?"
1|| Donor in the world’s first successful human heart transplant.||2|| Thanksgiving (US).||3|| Dunnock.||4|| Crossword puzzle.||5|| Robert Doisneau.||6|| Leningrad (St Petersburg).||7|| St Christopher.||8|| Eric Clapton.||9|| Words of repeated vowels (in OED): aa; ee; oo.||10|| Lord Wardens of the Cinque Ports.||11|| Mickey Mouse Club alumni.||12|| Bridges over the Grand Canal in Venice.||13|| Horses ridden in competition by Princess Anne and Zara Tindall.||14|| So-called Five Good Emperors of Rome.||15|| On African flags: Kenya and Swaziland; Mozambique; Uganda; Angola; Lesotho.,https://www.theguardian.com/lifeandstyle/2018/sep/22/whose-outburst-inspired-rock-against-racism-weekend-quiz,1|| How did Denise Darvall unwittingly make medical history in 1967?||2|| What holiday is said to mark a meal shared by the Wampanoag people?||3|| Which garden bird is the only UK member of the accentor family?||4|| What first puzzled readers of the New York World in 1913?||5|| Who took the photo Kiss by the Hôtel de Ville?||6|| Which city suffered an 872-day siege in the second world war?||7|| Which saint is sometimes depicted with a dog’s head?||8|| Whose on-stage outburst prompted the founding of Rock Against Racism?||What links:||9|| Stream or lava type; northern dialect interjection; Hawaiian bird?||10|| Wellington; Churchill; Queen Mother; Admiral Boyce (currently)?||11|| Christina Aguilera; Justin Timberlake; Ryan Gosling; Britney Spears?||12|| Rialto; degli Scalzi; dell’Accademia; della Costituzione?||13|| Doublet; Goodwill; Toytown; High Kingdom?||14|| Nerva; Trajan; Hadrian; Antoninus Pius; Marcus Aurelius?||15|| Spears and shield; AK-47 and hoe; crane bird; machete; Mokorotlo hat?
1|| Lord Kitchener.||2|| Plants.||3|| Bellingcat.|| ||4|| Black Box.||5|| The Compleat Angler (Izaak Walton).||6|| Bangladesh.||7|| Language.||8|| Lithium.||9|| Dances in the video game Fortnite.||10|| Paralympic sports.||11|| Locations of Occupyprotest camps.||12|| Penguin species.||13|| Fictional fast food outlets: Buffy; Coronation Street; Pulp Fiction; The Simpsons.||14|| Khanates/divisions of the Mongol Empire.||15|| European Space Agency missions.,https://www.theguardian.com/lifeandstyle/2018/oct/20/the-weekend-quiz,"1 ||Who was a “great poster”, according to Elizabeth Asquith?||2|| What were transported in a Wardian case?||3|| What citizen journalist website was founded by Eliot Higgins?||4|| Katrin Quinol was the face, if not the voice, of which chart-topping act?||5|| Which book is a dialogue between a falconer, a fisherman and a hunter?||6|| Biman is the national airline of which Asian country?||7|| What has six functions, according to Roman Jakobson?||8|| What is the lightest metal?||What links:||9|| Best Mates; Electro Shuffle; Take the L; Flapper; Floss?||10|| Boccia; goalball; football five-a-side; sitting volleyball?||11|| Zuccotti Park, Lower Manhattan and outside St Paul’s Cathedral?||12|| Snares; Gentoo; Magellanic; Fiordland; Chinstrap?||13|| Doublemeat Palace; Prima Doner; Big Kahuna Burger; Krusty Burger?||14|| Golden Horde; Chagatai Khanate; Ilkhanate; Yuan dynasty?||15 ||Giotto; Ulysses; Herschel; Rosetta; Planck; Gaia?"
"1|| Amish (and some Mennonites).||2 ||Loretta Lynn (from Coal Miner’s Daughter).||3|| 1920s.||4 ||The Fast And The Furious.||5|| The Well-Tempered Clavier (48 Preludes and Fugues).||6 ||Peregrine falcon.||7|| Eritrea became independent.||8|| Royal Canadian mounted police.||9|| Words in English of Romani origin.||10|| Surnames of female pop duos: Tatu; Pepsi & Shirlie; Shakespears Sister; Tegan and Sara; Mel and Kim.||11 ||Major islands of the Solomon Islands.||12|| Building designs by Nicholas Grimshaw.||13 ||Alternative names for elements that give their chemical symbol: antimony, Sb; tungsten, W; gold, Au; lead, Pb; potassium, K; sodium, Na; mercury, Hg.||14|| Catalan sides in La Liga.||15 ||Number of official languages.",https://www.theguardian.com/lifeandstyle/2018/oct/13/which-bird-can-dive-at-speeds-of-up-to-200-mph-weekend-quiz,"1|| Which religious community lives by a set of rules called the Ordnung?||2|| Who was born “in a cabin on a hill in Butcher Holler”?||3 ||In what decade did the British Empire reach its territorial peak?||4|| What film series was inspired by Racer X, an article in Vibe magazine?||5|| Which work by Bach is in all 24 major and minor keys?||6|| Which bird can dive at speeds of up to 200 mph?||7|| Why has Ethiopia been landlocked since 1993?||8|| Which law enforcers wear ceremonial red serge?||What links:||9|| Chav; cushti; dinlo; mush; wonga?||10|| Katina & Volkova; DeMacque & Holliman; Fahey & Detroit; Quin; Appleby?||11|| Choiseul; Santa Isabel; New Georgia; Guadalcanal; Malaita?||12|| Eden Project; Camden Sainsbury’s; National Space Centre; Oxford Ice Rink?||13|| Stibium; wolfram; aurum; plumbum; kalium; natrium; hydrargyrum?||14|| Girona FC; RCD Espanyol; FC Barcelona?||15 Zimbabwe (16); Switzerland (4); Belgium (3); Canada (2); US (none)?"
1|| #MeToo. ||2|| Lighthouses. ||3|| North and South Korea. ||4|| Rhinoceros. ||5|| Minor league baseball. ||6|| #. ||7|| Byzantine (12th century). ||8|| (Eastern) Mediterranean. ||9|| Standard. ||10|| Rabbit breeds. ||11|| All ended by treaties of Paris. ||12|| Commentated on World Cup final: BBC radio; BBC TV; ITV. ||13|| Places that gave their names to fad diets. ||14|| Dante’s Circles of Hell. ||15|| Played by Charles Laughton on film.,https://www.theguardian.com/lifeandstyle/2018/jun/30/quiz-limbo-lust-treachery-bridge-of-no-return-william-bligh-thomas-eaton,"1|| Which protest movement was founded by Tarana Burke?||2|| The Corporation of Trinity House has responsibility for what structures?||3|| What is linked, or divided, by the Bridge of No Return?||4|| What gift for the pope was the subject of an Albrecht Dürer woodcut?||5|| In American sport, what is MiLB?||6|| What symbol is an octothorpe?||7|| Anna Komnene was a princess and historian of which empire?||8|| The original lingua franca was spoken around which sea?||What links:||9|| Flag; norm; gold exchange system; popular song; evening paper?||10|| Flemish Giant; French Lop; Chinchilla; Rex; Angora; Himalayan?||11|| Seven Years’, Crimean, American Revolutionary and first world wars?||12|| Brian Moore and Alan Clarke; Kenneth Wolstenholme; Hugh Johns, in 1966?||13|| Scarsdale, New York; Beverly Hills; South Beach, Florida?||14|| Limbo (1); Lust (2); Gluttony (3); Heresy (6); Fraud (8); Treachery (9)?||15|| King Herod; Henry VIII; Rembrandt; Captain Kidd; William Bligh?"
1|| Jeremy Thorpe (by Auberon Waugh). ||2|| Slippery track surface. ||3|| SpaceX’s Falcon Heavy (February 2018 launch). ||4|| One for my baby (and one more for the road). ||5|| Bend It Like Beckham. ||6|| Scapa Flow (Orkney). ||7|| Haiku. ||8|| Armagh (Roman Catholic and Church of Ireland; currently Eamon Martin & Richard Clarke). ||9|| Types of lily. ||10|| Places in Florida. ||11|| Played Calamity Jane: The Paleface; Calamity Jane; Deadwood. ||12|| Ministries in Orwell’s Nineteen Eighty-Four. ||13|| Parts of London zoo. ||14|| Language families with the most languages. ||15|| (Alleged) English prophetesses.,https://www.theguardian.com/lifeandstyle/2018/jul/21/quiz-dog-lovers-party-1979-rocket-jane-russell-thomas-eaton,"1|| Which MP was opposed by the Dog Lovers’ party in 1979?||2|| In Formula One, what does a yellow and red striped flag indicate?||3|| Which rocket’s payload was a Tesla Roadster?||4|| What did Sinatra ask for at a “quarter to 3”?||5|| Which film features the Hounslow Harriers football team?||6|| The Churchill Barriers were built to protect which anchorage?||7|| Which verse form traditionally has a 5-7-5 syllable pattern?||8|| Which archbishop is the Primate of All Ireland?||What links:||9|| Madonna; Easter; Turk’s cap; martagon; tiger; trumpet?||10|| Naples; St Petersburg; Venice; Margate; Wellington; Dunedin?||11|| Jane Russell (comedy); Doris Day (musical); Robin Weigert (TV)?||12|| Love; Peace; Plenty; Truth?||13|| Blackburn Pavilion; Snowdon Aviary; Mappin Terraces; Penguin Beach?||14|| Niger-Congo; Austronesian; Trans-New Guinea; Sino-Tibetan?||15|| Ursula Southeil (Mother Shipton); Elizabeth Barton (Nun of Kent); Joanna Southcott?"
"1|| Billionaires (1,000,000,000). ||2|| Virago. ||3|| Territory ruled jointly by different sovereign powers. ||4|| Aspirin. ||5|| Noam Chomsky. ||6|| Turkey. ||7|| Young X-Men (in Marvel comics). ||8|| Theremin. ||9|| Current baseball teams never to win the World Series: Colorado; Milwaukee; Seattle; San Diego; Tampa Bay; Texas; Washington. ||10|| Queen’s great-grandchildren. ||11|| River Wye. ||12|| Celebrated Northern soul venues. ||13|| Sculptures by Camille Claudel. ||14|| Spell different words backwards: dog; lager; pals; time; reviled; deer; desserts; evil. ||15|| Spin-off TV shows: Love Island; Bake-Off; The Apprentice; Strictly.",https://www.theguardian.com/lifeandstyle/2018/jul/07/quiz-the-mature-age-the-waltz-rodin-xaviers-school-wigan-casino-thomas-eaton,"1|| Who are said to be members of the 3-comma club?||2|| Fenwomen, in 1973, was which publisher’s first book?||3|| Geographically, what is a condominium?||4|| What is acetylsalicylic acid’s more common name?||5|| Who made a grammatical point with “colorless green ideas sleep furiously”?||6|| In what country are the Gulenists an alleged fifth column?||7|| Who studied at Xavier’s School for Gifted Youngsters?||8|| What electronic musical instrument is played without any physical contact?||What links:||9|| Rockies; Brewers; Mariners; Padres; Rays; Rangers; Nationals?||10|| Savannah; Isla; George; Mia; Charlotte; Louis; Lena?||11|| Plynlimon and the Severn, via Hereford and Chepstow?||12|| The Catacombs; Wigan Casino; Twisted Wheel; the Golden Torch?||13|| The Mature Age; The Waltz; Perseus And The Gorgon; Rodin?||14|| God; regal; slap; emit; deliver; reed; stressed; live?||15|| Aftersun; An Extra Slice; You’re Fired!; It Takes Two?"
1|| Charlemagne. ||2|| Iran. ||3|| Farting. ||4|| Halloween. ||5|| 2018 royal wedding. ||6|| Ned Kelly and co. ||7|| Project Gutenberg. ||8|| Candlestick. ||9|| Insect names: Lady Bird Johnson (US first lady); real name of Adam Ant; Madame Butterfly; bassist Flea (Red Hot Chili Peppers). ||10|| Christograms (monograms representing Jesus). ||11|| Footballers who played in five World Cups. ||12|| Ambridge locations in The Archers. ||13|| Prime ministers giving birth: New Zealand and Pakistan. ||14|| Largest moons of: Mars; Jupiter; Saturn; Uranus; Neptune. ||15|| Tallest structures in the UK (all communications masts/towers).,https://www.theguardian.com/lifeandstyle/2018/jul/14/quiz-carol-ann-duffy-long-walk-herring-grey-gables-hotel-thomas-eaton,"1 ||Whose father was Pepin the Short and his son Pepin the Hunchback?||2|| Which country has provinces called East and West Azerbaijan?||3|| What unusual method of communication has been observed in herring?||4|| Samhain was a Celtic precursor to which festival?||5|| Carol Ann Duffy’s poem Long Walk marked what event?||6|| Who made his last stand at Glenrowan, Victoria, in 1880?||7|| What project offers 57,000 free eBooks online?||8|| What decorative item might have a knop, column, sconce and pricket?||What links:||9 ||Claudia Johnson; Stuart Goddard; Cio-Cio-San; Michael Balzary?||10|| X; XP; IHS; ICXC; INRI?||11|| Lothar Matthäus, (West) Germany; Rafael Marquez and Antonio Carbajal, Mexico?||12|| Bridge Farm; Grey Gables hotel; the Bull pub; St Stephen’s church?||13|| Jacinda Ardern in June and Benazir Bhutto in 1990?||14|| Phobos; Ganymede; Titan; Titania; Triton?||15|| Skelton; Belmont; Caldbeck; Emley Moor; Durris?"
"1|| Psycho. ||2|| Capital eszett (ß).||3|| James Brown (Godfather of Soul). ||4|| (Sacred) scarab. ||5|| Royal Society. ||6|| Bermuda Triangle. ||7|| Dutch settlers in South Africa (19th century). ||8|| Anna Freud. ||9|| Fictional characters married to Betty. ||10|| Greyhound racing trap colours. ||11|| TV theme tunes: The Apprentice; Top Gear; Ski Sunday; Mastermind; University Challenge. ||12|| Known as hammers: 8th century Frankish leader; king, H of the Scots; Molotov, Soviet leader, from Russian for hammer; MC Hammer. ||13|| Types of vertebrae in the spine. ||14|| Animals that use echolocation. ||15|| Largest Antarctic islands (south of 60° S).",https://www.theguardian.com/lifeandstyle/2018/aug/04/quiz-barney-rubble-frank-spencer-don-draper-thomas-eaton,"1|| What 1960 film prompted Observer critic CA Lejeune to resign from her job?||2|| What capital was declared an official German letter in 2017?||3|| Which singer wore a jumpsuit embellished with GFOS?||4|| What dung beetle was revered by the ancient Egyptians?||5|| Which society’s motto is “Nullius in verba” (“Take nobody’s word for it”)?||6|| What lies roughly between Hamilton, Miami and San Juan?||7|| Who undertook the Great Trek?||8|| Who started the Hampstead Child Therapy Course in 1947?||What links:||9|| Cyril Turpin; Barney Rubble; Frank Spencer; Don Draper?||10|| 1, red; 2, blue; 3, white; 4, black; 5, orange; 6, black and white stripes?||11|| Dance Of The Knights; Jessica; Pop Looks Bach; Approaching Menace; College Boy?||12|| Charles Martel; Edward I; Vyacheslav Skryabin; Stanley Burrell?||13|| Cervical; thoracic; lumbar; sacral; coccygeal?||14|| Shrews; oilbirds and swiftlets; bats; whales; dolphins?||15|| Alexander; Berkner; Thurston; Carney; Roosevelt; Siple?"
1 ||Henry I. ||2 ||Basque country. ||3 ||Beatrix Potter. ||4|| Liberia.||5|| Birdwatching (hobby falcon).||6|| Drake.||7|| Yiddish.||8|| Human flesh.||9|| Statues in Parliament Square (since 2000).||10|| Australian aboriginal language/people.||11|| Gave name to currencies: lek; colón; bolívar and bolíviano.||12|| Natural dyes.||13|| Teenage songs: T Rampage; T Dream; T Kicks; T Dirtbag; T Dream.||14|| Sources/inspirations for Lloyd Webber musicals: Joseph; Jesus Christ Superstar; Starlight Express; The Phantom Of The Opera; Cats.||15|| UK onshore oilfields.,https://www.theguardian.com/lifeandstyle/2018/jul/28/quiz-mandela-lloyd-george-gandhi-millicent-fawcett-thomas-eaton,"1 ||Which king’s wife, mother and heir were all called Matilda?||2 ||Where is the Ikurriña flag flown?||3 ||Which writer had rabbits called Benjamin Bouncer and Peter Piper?||4 ||Which country was founded by the American Colonization Society?||5 ||Observing a hobby might be part of what hobby?||6 ||Which rapper is Drizzy on Twitter and Champagne Papi on Instagram?||7 ||The exclamation “oy vey” comes from which language?||8 ||What is served at a Thyestean banquet?||What links:||9 ||Mandela; Lloyd George; Mahatma Gandhi; Millicent Fawcett (2018)?||10 ||Arrernte; Dhuwal-Dhuwala; Tiwi; Pitjantjatjara; Alyawarr?||11 ||Alexander the Great (Albania); Columbus (Costa Rica); Simón Bolívar (Venezuela and Bolivia)?||12 ||Kermes; cochineal; madder; saffron; woad; logwood?||13 ||The Sweet; T Rex; the Undertones; Wheatus; Katy Perry?||14 ||Book of Genesis; Gospels; Thomas the Tank Engine; Gaston Leroux; TS Eliot?||15 ||Wytch Farm, Dorset; Welton, Lincolnshire; Stockbridge, Hampshire?"
