answers,link,questions
1|| There’s No One Quite Like Grandma. ||2|| Red and roe. ||3|| Jack Worthing (The Importance Of Being Earnest). ||4|| TV antenna. ||5|| Devon Loch. ||6|| Natural sciences. ||7|| Willy Brandt. ||8|| Galápagos islands. ||9|| Parliaments: Scottish Parliament in Scottish Gaelic; Welsh Assembly in Welsh; Isle of Man Tynwald in Manx. ||10|| Julia Louis-Dreyfus characters: Seinfeld; New Adventures Of Old Christine; Veep. ||11|| Nominated works of recent Turner prize winners: Assemble; Duncan Campbell; Laure Prouvost; Elizabeth Price. ||12|| Dishes cooked with blood. ||13|| US state capitals named after presidents: Lincoln; Jackson; Madison. ||14|| Presented The Price Is Right in the UK. ||15|| Works by Swifts: Taylor S album; Jonathan S satire; Graham S novel.,https://www.theguardian.com/lifeandstyle/2016/oct/22/queen-mother-british-deer-bruce-forsyth-quiz-general-knowledge,1|| The Queen Mother’s 80th birthday inspired which much-loathed song?||2|| Which two deer species are native to Britain?||3|| Who was found by Thomas Cardew in Victoria station?||4|| What household object is a Yagi-Uda array?||5|| Which Grand National horse is a byword for last-minute failure?||6|| What does a natsci study?||7|| Who famously knelt at the Warsaw Ghetto Memorial?||8|| The Archipiélago de Colón is better known as what?||What links:||9|| Pàrlamaid na h-Alba; Cynulliad Cenedlaethol Cymru; Tinvaal?||10|| Elaine Benes; Christine Campbell; Selina Meyer?||11|| Granby Four Streets; It For Others; Wantee; The Woolworths Choir Of 1979?||12|| Blodplättar; boudin noir; blutwurst; czernina soup?||13|| Nebraska; Mississippi; Wisconsin?||14|| Leslie Crowther; Bob Warman; Bruce Forsyth; Joe Pasquale?||15|| 1989; A Modest Proposal; Last Orders?
1|| (Lesser) flamingo. ||2|| Jawaharlal Nehru. ||3|| John Harvey-Jones. ||4|| The Alfred Jewel. ||5|| Rhenium (Rhine). ||6|| USA. ||7|| On the back of tightrope walker Charles Blondin. ||8|| HG Wells’s Island of Dr Moreau. ||9|| Baseball nicknames: Joe DiMaggio; Reggie Jackson; Babe Ruth; Ty Cobb. ||10|| Jeromes: St Jerome; Jerome D Salinger; Jerome K Jerome. ||11|| Drama schools. ||12|| Last eruption of volcanoes. ||13|| Born in Nairobi. ||14|| Video game companies. ||15|| Directed James Dean films: East of Eden; Rebel Without a Cause; Giant.,https://www.theguardian.com/lifeandstyle/2016/aug/20/elia-kazan-tanzania-lake-tryst-with-destiny-quiz-general-knowledge,"1|| 75% of what bird’s global population hatches at Lake Natron, Tanzania?||2|| Who made the 1947 “tryst with destiny” speech?||3|| Which ex-head of ICI became a TV personality?||4|| “Aelfred mec heht gewyrcan” is inscribed on what?||5|| Which element is named after a European river?||6|| Who has won the Fifa Women’s World Cup three times?||7|| How did Harry Colcord cross Niagara Falls in 1859?||8|| Which novel features a leopard-man and swine-woman?||What links:||9|| Joltin’ Joe; Mr October; Sultan of Swat; the Georgia Peach?||10|| Vulgate Bible; The Catcher In The Rye; Three Men In A Boat?||11|| Italia Conti; Webber Douglas; Rose Bruford; Sylvia Young?||12|| Fuji, 1707; Vesuvius, 1944; Mauna Loa, 1984; St Helens, 2008?||13|| Philippa Gregory; Richard Leakey; Richard Dawkins; Chris Froome?||14|| Capcom; Rockstar; Eidos; Konami; Ubisoft?||15|| Elia Kazan; Nicholas Ray; George Stevens?"
1|| Cluedo/Clue game. ||2|| Wind. ||3|| & (ampersand). ||4|| Princess Anne. ||5|| Orwell’s Animal Farm. ||6|| Satraps. ||7|| Johannes Kepler. ||8|| No casualties in the first world war. ||9|| Voiceover artists: X Factor; Big Brother; film trailers. ||10|| Dutch (or Anglo-Dutch) companies. ||11|| Times zones in continental USA. ||12|| Scored three goals in World Cup finals. ||13|| Designed by architect Arne Jacobsen. ||14|| Types of eel. ||15|| Female Ancient Greek poets.,https://www.theguardian.com/lifeandstyle/2016/jul/30/quiz-pele-geoff-hurst-royal-home-thankful-village-general-knowledge,"1|| Where has Dr Orchid replaced Mrs White?||2|| What plays an Aeolian harp?||3|| What symbol originated as the ligature of the letters “et”?||4|| Gatcombe Park is the country home of which royal?||5|| Which book features the anthem Beasts Of England?||6|| Regional governors in the Achaemenid Empire were called what?||7|| Which astronomer defended his mother in a witchcraft trial in the 1620s?||8|| In England and Wales, what characterised a “thankful village”?||What links:||9|| Peter Dickson; Marcus Bentley; Redd Pepper?||10|| Unilever; Philips; Shell; TomTom; Endemol?||11|| Eastern; Central; Mountain; Pacific; Alaskan?||12|| Pelé; Vavá; Geoff Hurst; Zinedine Zidane?||13|| St Catherine’s College, Oxford; Egg, Swan and Ant chairs; Danish embassy, London?||14|| Spaghetti; pike; longneck; moray; conger?||15|| Telesilla; Melinno; Sappho; Erinna; Nossis; Praxilla?"
"1|| Vietnam War Memorial, Washington DC. ||2|| Cannibalism. ||3|| Platinum, gold and silver discs. ||4|| Eyesight. ||5|| Marc and IK Brunel. ||6|| Italian vermouth. ||7|| Liverpool fans (You’ll Never Walk Alone). ||8|| Walter Scott’s Waverley. ||9|| Toes. ||10|| Mrs in films: M Miniver; M Dalloway; M Brown; M Doubtfire. ||11|| Titles held by Prince Andrew. ||12|| Grand National courses: Irish; Welsh; Scottish; English. ||13|| Works by Pushkin, adapted as operas. ||14|| Designed by Zaha Hadid. ||15|| Adoption of the Gregorian calendar.",https://www.theguardian.com/lifeandstyle/2016/jul/23/what-links-pig-rhino-goat-horse-thames-tunnel-twitter-quiz,"1|| Which American memorial features 58,307 names?||2|| What was the legendary Sawney Bean’s odd predilection?||3|| What UK music sales certification scheme was introduced in 1973?||4|| What is a LogMAR chart used to test?||5|| Who built the first tunnel under the Thames?||6|| What is it in a gin and it?||7|| Who uses the Twitter hashtag #YNWA?||8|| ‘Tis Sixty Years Since was the subtitle of which novel?||What links:||9|| Pig, four; rhino, three; goat, two; horse, one?||10|| Greer Garson; Vanessa Redgrave; Judi Dench; Robin Williams?||11|| Duke of York; Earl of Inverness; Baron Killyleagh?||12|| Fairyhouse; Chepstow; Ayr; Aintree?||13|| The Queen Of Spades; Boris Godunov; Eugene Onegin; Ruslan And Lyudmila?||14|| Olympic Aquatic Centre and Evelyn Grace Academy, London; MAXXI Museum, Rome?||15|| France (1582); Britain (1752); Japan (1873); Russia (1918)?"
1|| Henri Bergson. ||2|| Naval Criminal Investigative Service. ||3|| Graviton. ||4|| Olivia de Havilland and Joan Fontaine. ||5|| Lakes Michigan and Huron. ||6|| David Brent. ||7|| Brown hyena. ||8|| Donington Park. ||9|| Pokémon (1-5). ||10|| Surfaces of tennis grand slams: Australian; French; Wimbledon; US. ||11|| Whitehall cats. ||12|| Works by Hildegard of Bingen. ||13|| Charity symbols: WWF; RSPB; National Trust; Marie Curie; Amnesty International. ||14|| River tidal bores. ||15|| Prizes not awarded.,https://www.theguardian.com/lifeandstyle/2016/aug/06/quiz-marcel-proust-oscar-winning-sisters-general-knowledge,"1|| Marcel Proust was best man at which philosopher’s wedding?||2|| In the TV series, what does NCIS stand for?||3|| G is the symbol of what hypothetical elementary particle?||4|| Which sisters are the only siblings to have won lead acting Oscars?||5|| The Straits of Mackinac connect which lakes?||6|| Which “entertainer” is lead singer in Foregone Conclusion?||7 ||What African animal is known as the strand wolf?||8|| Which racetrack used to host the Monsters of Rock festival?||What links:||9 ||Bulbasaur; Ivysaur; Venusaur; Charmander; Charmeleon?||10|| Plexicushion; red clay; perennial ryegrass; DecoTurf?||11|| Larry; Palmerston; Freya; Humphrey; Sybil; Wilberforce?||12|| Know The Ways; Book Of Life’s Merits; Book Of Divine Works; Play Of The Virtues?||13|| Giant panda; avocet; oak leaf; daffodil; candle in barbed wire?||14|| Mascaret, Seine; Aegir, Trent; Silver Dragon, Qiantang; Pororoca, Amazon?||15|| Pulitzer prize for fiction 2012; Nobel peace prize 19 times and physics prize 1931 and 1934?"
What links:||9 ||Kedleston Hall; Harewood House; Culzean Castle; Pulteney Bridge?||10 ||Frankie Laine (18); Bryan Adams (16); Wet Wet Wet and Drake (15)?||11 ||Lukash Dairy; The Bears; Bedrock Boulders; Springfield Isotopes?||12 ||Alkyl nitrites; The Poverty Of Historicism; Friday Night Dinner?||13 ||Bodmin Moor pub; first Mrs de Winter; Philip Ashley’s relative; Arne’s patriotic song?||14 ||G-D-A-E; C-G-D-A; C-G-D-A; E-A-D-G?||15 ||Billund; Windsor; Günzburg; Malaysia; California; Florida?,https://www.theguardian.com/lifeandstyle/2016/sep/10/bryan-adams-wet-wet-wet-weekend-quiz,"1 ||Which vessels were deemed “underhand, unfair and damned un-English”?||2 ||In economics, what characterises a Minsky moment?||3 ||Which bird of prey is nicknamed the skydancer?||4 ||Who are commemorated by the Thiepval Memorial?||5 ||Facehuggers and chestbursters feature in which film series?||6 ||What punctuation mark is an eroteme?||7 ||Steiff Bär 55 PB was a prototype of what?||8 ||In what sport does the libero wear a different colour jersey from his or her team-mates?"
1|| Sargasso Sea. ||2|| Bleak House. ||3|| Prions. ||4|| David Bowie. ||5|| Geoff Boycott. ||6|| (Motorised) taxi. ||7|| 27 (7+8+12). ||8|| Henry the Young King (Henry II’s son). ||9|| Hormones produced in the pancreas. ||10|| Gave names to hats: trilby; tam o’shanter; fedora. ||11|| Viking place name suffixes. ||12|| Jazz aristocracy: King; Queen; Duke; Count; Earl; Lady. ||13 ||Named after home town/birthplace. ||14 ||Semitic languages. ||15|| Elizabeth Taylor’s husbands’ professions: Hilton; Wilding; Todd; Fisher; Burton; Warner; Fortensky.,https://www.theguardian.com/lifeandstyle/2016/sep/03/all-european-eels-are-born-in-which-sea-weekend-quiz,"1|| All European eels are born in which sea? ||2|| Which title property was owned by John Jarndyce?||3|| Proteinaceous infectious particles are better known as what? ||4|| Who had 19 albums in the top 100 in January? ||5|| Which cricketer was Theresa May’s childhood hero?||6|| The Daimler Victoria was the first of what type of vehicle? ||7|| Magnificent + Hateful + Dirty = how many desperados? ||8|| Who was crowned in 1170, but never became king?||What links:|| ||9|| Insulin; glucagon; somatostatin? ||10|| George du Maurier novel; Robert Burns poem; Victorien Sardou play? ||11|| -holme; -thorpe; -thwaite; -by; -keld; -toft? ||12|| Oliver; Fitzgerald; Ellington; Basie; Hines; Holiday? ||13|| Leonardo da Vinci; Hieronymus Bosch; Nellie Melba; Florence Nightingale?||14|| Arabic; Amharic; Tigrinya; Hebrew; Maltese? ||15|| Hotelier; actor; producer; singer; actor; senator; construction worker?"
2 ||The aha ha is an Australian species of which insect?,https://www.theguardian.com/lifeandstyle/2016/sep/17/the-weekend-quiz-thomas-eaton,"1|| “Ismay Safe, Mrs Astor Maybe, Noted Names Missing” referred to what?"
1|| Che Guevara. ||2|| Folk songs. ||3|| Moscow. ||4|| Grete Waitz. ||5|| PDSA to brave animals. ||6|| Paid income (and capital gains) tax. ||7|| He was Zorro. ||8|| Apple. ||9|| Novels set in Saudi Arabia: Dave Eggers; Hilary Mantel; Abdelrahman Munif. ||10|| Bynames of Holst’s Planets: Mars; Venus; Mercury; Jupiter; Saturn; Uranus; Neptune. ||11|| Won European Cup/Champions League as player and manager. ||12|| Fictional quiz shows: Friends; Adam and Joe; Only Fools And Horses; Mitchell and Webb. ||13|| Early “magic bullets” to treat diseases. ||14|| Canonised in 2016. ||15|| London Unesco World Heritage Sites.,https://www.theguardian.com/lifeandstyle/2016/sep/24/quiz-new-york-marathon-dicken-medal-general-knowledge,"1|| Who was shot by Bolivian soldier Mario Teran in 1967?||2|| What works are compiled on the Roud Index?||3|| ZiL lanes run through which capital city?||4|| Which Norwegian woman won the New York marathon nine times?||5|| Who awards the Dickin Medal, and to whom?||6|| What has the Queen done since 6 April 1993?||7|| What was the swashbuckling secret of Don Diego de la Vega?||8|| The Beatles had a long-running legal dispute with what computer company?||What links:||9|| A Hologram For The King; Eight Months On Ghazzah Street; Cities Of Salt?||10|| War; Peace; Winged Messenger; Jollity; Old Age; Magician; Mystic?||11|| Muñoz; Trapattoni; Cruyff; Ancelotti; Rijkaard; Guardiola; Zidane?||12|| Bamboozled; Quizzlestick; Goldrush; Numberwang?||13|| Methylene blue (malaria); trypan red (sleeping sickness); Salvarsan (syphilis)?||14|| Mother Teresa; Elizabeth Hesselblad; Stanislaus Papczynski?||15|| Palace of Westminster and Abbey; the Tower; Maritime Greenwich; Kew Gardens?"
What links:||9|| Lakeland; Norfolk; Manchester; Sealyham; Airedale?||10|| Tom Brown; William Webb Ellis; Lewis Carroll; Neville Chamberlain?||11|| Hakka; Wu; Min; Yue; Gan; Xiang?||12|| Meitnerium and Curium (and no others)?||13|| Castlehill; Lawnmarket; High St; Canongate; Abbey Strand?||14|| Straight Life; Lady Sings The Blues; Beneath The Underdog; Miles?||15|| Andrew Johnson; Bill Clinton; Dilma Rousseff?,https://www.theguardian.com/lifeandstyle/2016/oct/01/the-quiz-what-links-tom-brown-and-lewis-carroll,"1|| A “We Don’t Climb” sign is at the foot of which monolith?||2|| Which uprising was sparked by maggot-ridden borscht?||3|| Which comedian was Nancy Astor’s niece?||4 In the body, what is cerumen?||5|| Which foundation sponsors Drawing and Fiction Uncovered prizes?||6|| “Oh my God, he’s won back the title at 32”: who on whom?||7|| Who is Ulrich in the title of a Robert Musil novel?||8|| Which Teletubby has a hyphenated name?"
1|| Uefa Champions League. ||2|| Alexander Kerensky. ||3|| Young puffin. ||4|| Daks. ||5|| Easter Island/Rapa Nui. ||6|| Nanook Of The North. ||7|| Shortest run (one performance). ||8|| Franco-Prussian war. ||9|| Goddhard rail tunnel in Switzerland. ||10|| Sea turtle species. ||11|| Characters created by a James: EL; PD; Henry. ||12|| Prehistoric cave paintings. ||13|| Types of lamp. ||14|| Played Spider-Man. ||15|| Final answers to win top prize on Who Wants To Be A Millionaire?.,https://www.theguardian.com/lifeandstyle/2016/jun/25/moose-murders-trousers-telegram-trees-quiz-general-knowledge,"1|| “Ce sont les meilleures équipes” is the start of which “anthem”?||2|| Which Russian leader is buried in Putney?||3|| What is a puffling?||4|| Which brand of trousers pioneered the adjustable waistband?||5|| Where are the 887 giant sculptures known as moai?||6|| Inuit Allakariallak was the star of which silent-era documentary?||7|| What Broadway record was set by Moose Murders in 1983?||8|| The Ems telegram helped incite which conflict?||What links:||9|| Erstfeld in Uri and Bodio in Ticino (57km away)?||10|| Kemp’s ridley; hawksbill; loggerhead; flatback; leatherback?||11|| Anastasia Steele; Cordelia Gray; Daisy Miller?||12|| Chauvet and Lascaux, France; Altamira, Spain; Coliboaia, Romania?||13|| Davy; standard; hurricane; lava; gooseneck; Anglepoise?||14|| Nicholas Hammond; Tobey Maguire; Andrew Garfield; Tom Holland?||15|| Henry II; trees; volt; Arlington Million; Bombardier Billy Wells?"
1|| Buffy Summers (Vampire Slayer). ||2|| Church of England clergy. ||3|| Naturists. ||4|| Noah Webster. ||5|| Ostrich. ||6|| Jenny Diski. ||7|| Top of the stocking (Highland dress). ||8|| Men’s and women’s table tennis. ||9|| Isles of Scilly. ||10|| Origins of proposed names of new elements: Nihonium; Moscovium; Tennessine; Oganesson. ||11|| Westerns to win Oscar for best picture. ||12|| Roman villas in England. ||13|| “Impossible” objects/optical illusions. ||14|| British motorcycle manufacturers. ||15|| Songs with a year in the title: Paris 1919; 1944; 1979; 1984; 1999; Disco 2000.,https://www.theguardian.com/lifeandstyle/2016/jul/02/john-cale-jamala-smashing-pumpkins-bowie-prince-pulp-quiz,"1 ||Whose gravestone read, “She Saved The World A Lot”?||2|| Who were the recipients of Queen Anne’s Bounty?||3|| Spielplatz near St Albans is Britain’s oldest resort for whom?||4|| Who published the 1828 American Dictionary Of The English Language?||5|| The common and Somali are the two species of which bird?||6|| Which writer was “adopted” by Doris Lessing as a teenager?||7|| Where is a sgian dubh worn?||8|| Which world champions win the St Bride Vase and Geist prize?||What links:||9|| St Mary’s; Tresco; St Martin’s; St Agnes; Bryher?||10|| Japan (113); Moscow (115); Tennessee (117); Yuri Oganessian (118)?||11|| Cimarron; Dances With Wolves; Unforgiven (and no others)?||12|| Fishbourne; Lullingstone; Chedworth; Littlecote?||13|| Penrose triangle; Escher stairs; devil’s tuning fork; Necker cube?||14|| Norton; Triumph; Royal Enfield; Hesketh; Greeves?||15|| John Cale; Jamala; Smashing Pumpkins; David Bowie; Prince; Pulp?"
"1|| Sheep (in Swaledale). ||2|| Liberty. ||3|| Cochlea/inner ear. ||4|| Point Break. ||5|| Talisker. ||6|| Pet Sounds by the Beach Boys. ||7|| The National Trust. ||8|| Ring-shaped. ||9|| In numbered novels: Fifty Shades Of Grey; Catch-22; Nineteen Eighty-Four; The Thirty-Nine Steps. ||10|| Premier League managers, wins by nationality. ||11|| First nonstop transatlantic flight (by Alcock and Brown). ||12|| Derived SI units measuring radiation: radioactivity; absorbed dose; dose equivalent. ||13|| British moths. ||14|| Smithsonian museums. ||15|| Fictional women’s prisons: Prisoner: Cell Block H; Orange Is The New Black; Within These Walls; Bad Girls.",https://www.theguardian.com/lifeandstyle/2016/oct/15/isle-of-skye-anastasia-steele-quiz-general-knowledge,"1|| What are counted “Yan, tan, tether, mether...”? ||2|| Which shop was built from the timbers of HMS Impregnable and Hindustan? ||3|| Where in the body is the organ of Corti? ||4|| Which film features the bank-robbing Ex-Presidents? ||5|| What is the only distillery on the Isle of Skye? ||6|| Which album cover shows goats being fed at San Diego zoo? ||7|| What was founded by Octavia Hill, Robert Hunter and Hardwicke Rawnsley? ||8|| What shape are Gugelhupf and ciambella cakes? ||What links: ||9|| Anastasia Steele; Yossarian; Winston Smith; Richard Hannay? ||10|| Scottish (14); Italian, French and Portuguese (all three); Chilean (one)? ||11|| St John’s, Newfoundland and Clifden, Galway, 14-15 June 1919? ||12|| Becquerel; gray; sievert? ||13|| Broom; Cinnabar; Scalloped Oak; Puss; Jersey Tiger? ||14|| Air and Space; Art; Natural History; American History; African American History (19th, in 2016)? ||15|| Wentworth; Litchfield; Stone Park; Larkhall?"
"1|| Bioluminescence (fireflies, glow-worms, etc). ||2|| Tiramisu. ||3|| Live action role-playing. ||4|| Evelyn Waugh’s Brideshead Revisited (subtitle). ||5|| Campaign. ||6|| The Girl from U.N.C.L.E. ||7|| Indian Premier League cricket (most runs/most wickets). ||8|| Burning Man. ||9|| Bylines in Private Eye magazine. ||10|| Types of language. ||11|| Films based on Patricia Highsmith works. ||12|| North York Moors. ||13|| Had instrumental No 1 singles. ||14 ||Politicians born in NYC. ||15|| Extinct in the wild.",https://www.theguardian.com/lifeandstyle/2016/jun/11/talented-mr-ripley-dessert-desert-dove-general-knowledge-quiz,1|| What distinguishes a lampyrid insect?||2|| Which dessert’s name means “pick me up” in Italian?||3|| What sort of game is a LARP?||4|| What were the Sacred & Profane Memories of Captain Charles Ryder?||5|| Which magazine is the bible of the advertising industry?||6|| Who was April Dancer in a 1960s TV series?||7|| The Orange and Purple Caps are individual awards in what league?||8|| Which festival takes place in the Black Rock Desert in Nevada?||What links:||9|| Piloti; Gavel Basher; Remote Controller; Lunchtime O’Boulez?||10|| Pidgin; creole; koine; lingua franca?||11|| The Talented Mr Ripley; Carol; The American Friend; Strangers On A Train?||12|| Urra; Cringle; Stockdale; Danby High; Gisborough; Easby?||13|| The Shadows; Royal Scots Dragoon Guards; Fleetwood Mac; Mr Oizo?||14|| Theodore Roosevelt; Eamon de Valera; Donald Trump; Boris Johnson?||15|| Guam rail; Scimitar oryx; Socorro dove; Wyoming toad; Hawaiian crow?
"1|| Harold Pinter. ||2|| Camogie. ||3|| Yuri Gagarin. ||4|| Bison. ||5|| There Will Be Blood. ||6|| Sikh Empire. ||7|| Garlic. ||8|| The tailor of Gloucester. ||9|| Lead singers of AC/DC. ||10|| Greek gods of the four winds. ||11|| Players sent off in FA Cup finals. ||12|| Ghost ships. ||13|| Breeds of goat. ||14|| Leaders, daughters of political dynasties. ||15|| Base SI units: Kelvin; second; metre; Ampere; kilogram; candela; mole.",https://www.theguardian.com/lifeandstyle/2016/jun/18/milkshake-mammal-mary-celeste-quiz-general-knowledge,"1|| Who is the only Hackney-born Nobel prize-winner?||2|| Which women’s sport is a version of hurling?||3|| Which visitor was loaned a Rolls-Royce with the numberplates YG1?||4|| What was named US national mammal in May?||5 ||“I drink your milkshake” is a line from which film?||6|| Which empire was founded by Ranjit Singh?||7|| Allium sativum is which cooking ingredient?||8|| Which Beatrix Potter character had a cat called Simpkin?||What links:||9|| Bon Scott; Brian Johnson; Axl Rose?||10|| Boreas; Eurus; Notus; Zephyrus?||11|| Kevin Moran; Jose Reyes; Pablo Zabaleta; Chris Smalling?||12|| Mary Celeste, 1872; MV Joyita, 1955; Jian Seng, 2006?||13|| Saanen; Toggenburg; Angora; Alpine; Oberhasli?||14|| Indira Gandhi; Benazir Bhutto; Cory Aquino; Aung San Suu Kyi?||15|| K; s; m; A; kg; cd; mol?"
1|| North Korea (Kim Jong-il and Kim Il-sung). ||2|| UFOs. ||3|| Muji. ||4|| Winning Olympic and Paralympic medals. ||5|| White-tailed eagle. ||6|| George Eliot. ||7|| Signal flare. ||8|| Skepta. ||9|| Directed versions of Ben-Hur. ||10|| Giraffe species. ||11|| Bodies (or parts) moved/stolen. ||12|| Pythagorean triples. ||13|| Taxi music: Taxi Driver score; Big Yellow Taxi; Joe Le Taxi. ||14|| Location of Picasso museums. ||15|| H progression: H(-Blocks); HH (His Holiness); Triple H; HHhH.,https://www.theguardian.com/lifeandstyle/2016/oct/08/dear-leader-fencer-wrestler-general-knowledge-quiz,"1|| Where did the Dear Leader succeed the Great Leader? ||2|| Project Blue Book was the US Air Force investigation into what? ||3|| What company’s name comes from “no brand” in Japanese? ||4|| Hungarian fencer Pál Szekeres was the first person to complete which double? ||5|| What is the UK’s largest bird of prey? ||6|| Nuneaton hospital is named after which writer? ||7|| What is fired by a Very pistol? ||8|| Award-winning singer Joseph Adenuga has what stage name? ||What links: || ||9 ||Sidney Olcott; Fred Niblo; William Wyler; Timur Bekmambetov? ||10|| Northern; Southern; Reticulated; Masai? ||11|| Charlie Chaplin; Eva Perón; Joseph Haydn; Gram Parsons? ||12|| Three, four and five; five, 12 and 13; eight, 15 and 17; seven, 24 and 25? ||13|| Bernard Herrmann; Joni Mitchell; Vanessa Paradis? ||14|| Malaga; Barcelona; Antibes; Paris; Vallauris; Münster? ||15|| Maze prison buildings; addressing the pope; wrestler Paul Levesque; Laurent Binet novel?"
"1|| “Dr Livingstone, I presume?” ||2|| The universe. ||3|| Jackie. ||4|| Peyton and Eli Manning. ||5|| Technology, Entertainment and Design. ||6|| Slade. ||7 ||China’s Terracotta Army. ||8|| John Bull. ||9|| Parts of Tate Modern. ||10|| Killer: K bees; K whale; nicknamed the K. ||11|| National film awards: Germany; France; Italy; Spain. ||12|| Managers winning English title with two different football teams. ||13|| Largest cities north of the Arctic Circle. ||14|| Brides on film: The B Of Frankenstein; The Princess B; Runaway B; I Was A Male War B. ||15|| C: vitamin C; coulomb unit, symbol C; known as C (MI6); in Roman numerals.",https://www.theguardian.com/lifeandstyle/2016/jul/09/bees-orca-jerry-lee-lewis-super-bowl-quiz,"1|| “Yes,” said he, with a kind smile, lifting his cap slightly – the answer to what? ||2|| What’s growing at 45.5 miles per second per megaparsec? ||3|| In which magazine did Cathy and Claire answer readers’ problems? ||4|| Who are the only brothers to win the Super Bowl at quarterback? ||5|| What does the TED in TED talks stand for? ||6|| Which band became big after dropping Ambrose from its name? ||7|| Who were the eternal guards of Qin Shi Huang? ||8|| Which national personification was devised by Dr Arbuthnot? ||What links: ||9|| Switch House; The Tanks; Turbine Hall? ||10|| Africanised honey bees; orcas; Jerry Lee Lewis? ||11|| Bambi; César; David di Donatello; Goya? ||12|| Tom Watson; Herbert Chapman; Brian Clough; Kenny Dalglish? ||13|| Murmansk; Norilsk; Tromsø; Vorkuta? ||14|| Elsa Lanchester; Robin Wright; Julia Roberts; Cary Grant? ||15|| Ascorbic acid; electric charge; SIS head; 100?"
